{
  "bundle_type": "agentflow_proof_pack",
  "bundle_version": "1.0.0",
  "capabilities": {
    "missing": [],
    "recorded": [],
    "required": [],
    "waived": []
  },
  "checks": [
    {
      "count": 0,
      "id": "missing_plan_evidence_ids",
      "status": "passed"
    },
    {
      "count": 0,
      "id": "unused_evidence_ids",
      "status": "passed"
    },
    {
      "count": 0,
      "id": "steps_without_support",
      "status": "passed"
    },
    {
      "count": 0,
      "id": "dangling_supports",
      "status": "passed"
    },
    {
      "count": 0,
      "id": "dangling_used_for",
      "status": "passed"
    },
    {
      "count": 0,
      "id": "dangling_route_runtimes",
      "status": "passed"
    },
    {
      "drift_status": "pass",
      "id": "drift_audit",
      "status": "passed"
    },
    {
      "id": "required_review_satisfied",
      "message": "no required review run (review_depth=None)",
      "required_review_depth": null,
      "satisfied_by_depth": null,
      "status": "passed"
    },
    {
      "id": "review_gate",
      "message": "no review run recorded",
      "status": "not_run"
    },
    {
      "count": 0,
      "id": "required_capabilities_satisfied",
      "status": "passed"
    }
  ],
  "core_sha256": "16cd85037fb3941221877f0b50151f7447a4a82820a892bddbd9c3b99006ba91",
  "coverage": {
    "abandoned_attempts": [],
    "dangling_route_runtimes": [],
    "dangling_supports": [],
    "dangling_used_for": [],
    "expired_leases": [],
    "missing_plan_evidence_ids": [],
    "no_deadline_open_attempts": [],
    "steps_without_support": [],
    "unused_evidence_ids": []
  },
  "execution": {
    "amendments": [],
    "attempts": 1,
    "command_confirmed_high_risk": 0,
    "command_decision_counts": {},
    "command_finding_categories": {},
    "command_receipts": 2,
    "command_receipts_by_provenance": {
      "observed": 2
    },
    "command_risk_counts": {},
    "command_timed_out": 0,
    "command_timeout_seconds": {},
    "failed_attempts": [],
    "file_receipts": 3,
    "normalized_execution_sha256": "8036a428692b08fe0a28a2388ac4a2d93bea7dd8f5b1816b1add861ec866a60e",
    "steps_completed": 1,
    "steps_total": 1,
    "unmapped_changed_files": [],
    "verification_runs": 2
  },
  "files": [
    {
      "path": ".agent/amendments.jsonl",
      "sha256": "e3b0c44298fc1c149afbf4c8996fb92427ae41e4649b934ca495991b7852b855"
    },
    {
      "path": ".agent/assumptions.json",
      "sha256": "a054b7b5d8bed917c9b81ab69c61139f78e9687aa5fe88c6b816b5c087dc9a4e"
    },
    {
      "path": ".agent/command-receipts.jsonl",
      "sha256": "bc43b1552a7e503ac3971c45518f54223fd962dbe92cda7eb6bcd3df324d686d"
    },
    {
      "path": ".agent/context-receipts.jsonl",
      "sha256": "e3b0c44298fc1c149afbf4c8996fb92427ae41e4649b934ca495991b7852b855"
    },
    {
      "path": ".agent/drift-report.json",
      "sha256": "dfdd9b1c4e08262eece393f576ca9002724e75ef163caa730c66e7ed3c010ffc"
    },
    {
      "path": ".agent/evidence.jsonl",
      "sha256": "93df8b36ccbc20bfffc190427dd7a1449b13f5686aae5eb9667b4e50d98df159"
    },
    {
      "path": ".agent/execution.contract.json",
      "sha256": "7d6b800a2cfeab71cf7e3e01e2923b46a7d4e9224a94e9eee6a8d4ccb8d79a7d"
    },
    {
      "path": ".agent/failures.jsonl",
      "sha256": "445866bb363bb9bfe7e1d35baaf69c3502b354c4f260e8bab13890ee742a93fc"
    },
    {
      "path": ".agent/file-receipts.jsonl",
      "sha256": "de9fed937d6a21b465a89a7e1317dd4f51daa18f0886362a80f72e3b350ea1e7"
    },
    {
      "path": ".agent/plan.lock.json",
      "sha256": "5ecfa02787f954481ac98fa3b61741d23c2658435f1879077f29e2f7acb2da75"
    },
    {
      "path": ".agent/step-runs.jsonl",
      "sha256": "8b394357cd672fb21d02a3d6249100419d588a6d2c6ba45c2eb6d5a3ee35d3fd"
    },
    {
      "path": ".agent/verification-runs.jsonl",
      "sha256": "0493f41844d63785d4b7a30e2c93e0ba043639f6618cea430f0adf8fddd09433"
    }
  ],
  "generated_from": [
    ".agent/amendments.jsonl",
    ".agent/assumptions.json",
    ".agent/command-receipts.jsonl",
    ".agent/context-receipts.jsonl",
    ".agent/drift-report.json",
    ".agent/evidence.jsonl",
    ".agent/execution.contract.json",
    ".agent/failures.jsonl",
    ".agent/file-receipts.jsonl",
    ".agent/plan.lock.json",
    ".agent/step-runs.jsonl",
    ".agent/verification-runs.jsonl"
  ],
  "meta": {
    "created_at": "2026-09-07T15:14:08+00:00",
    "tool_version": "0.4.0"
  },
  "review": {
    "correlations": [],
    "latest_review_run_id": null,
    "policy": {
      "proof_strict_effective": false,
      "require_review_run": false,
      "required_review_depth": null,
      "review_gate_effective": "warn",
      "verification_semantics": "ratchet-v1"
    },
    "review_runs": [],
    "unresolved_finding_refs": []
  },
  "schema_version": "1.0.0",
  "stuck": {
    "findings": [],
    "rules_evaluated": 3
  }
}
