{
  "bundle_type": "agentflow_proof_pack",
  "bundle_version": "0.11.0",
  "capabilities": {
    "missing": [],
    "recorded": [
      "tdd"
    ],
    "required": [
      "tdd"
    ],
    "waived": []
  },
  "checks": [
    {
      "count": 0,
      "id": "missing_plan_evidence_ids",
      "status": "passed"
    },
    {
      "count": 0,
      "id": "unused_evidence_ids",
      "status": "passed"
    },
    {
      "count": 1,
      "id": "steps_without_support",
      "status": "warning"
    },
    {
      "count": 0,
      "id": "dangling_supports",
      "status": "passed"
    },
    {
      "count": 0,
      "id": "dangling_used_for",
      "status": "passed"
    },
    {
      "count": 0,
      "id": "dangling_route_runtimes",
      "status": "passed"
    },
    {
      "count": 0,
      "id": "criteria_satisfied",
      "message": "all acceptance criteria are satisfied",
      "status": "passed"
    },
    {
      "drift_status": "pass",
      "id": "drift_audit",
      "status": "passed"
    },
    {
      "id": "workflow_contract_valid",
      "status": "passed"
    },
    {
      "id": "required_review_satisfied",
      "message": "no required review run (review_depth=standard)",
      "required_review_depth": "standard",
      "satisfied_by_depth": null,
      "status": "passed"
    },
    {
      "id": "review_gate",
      "message": "latest gate_status=pass, active_blocking=0",
      "status": "passed"
    },
    {
      "count": 0,
      "id": "review_artifacts_present",
      "status": "passed"
    },
    {
      "count": 0,
      "id": "review_finding_refs_resolved",
      "status": "passed"
    },
    {
      "count": 0,
      "id": "required_capabilities_satisfied",
      "status": "passed"
    }
  ],
  "core_sha256": "6645ec6bea9d87547b3d0ddba51d1c0c5a8cc60d2818f9eeb02e949b2b8ef54b",
  "coverage": {
    "abandoned_attempts": [],
    "criterion_status_counts": {
      "failed": 0,
      "missing": 0,
      "satisfied": 1,
      "unmapped": 0
    },
    "dangling_route_runtimes": [],
    "dangling_supports": [],
    "dangling_used_for": [],
    "design_decisions": [
      {
        "id": "DD-FIXTURE",
        "references": [
          "docs/golem-integration.md"
        ],
        "steps": [
          "P1"
        ],
        "text": "Keep design guidance inside the locked plan."
      }
    ],
    "expired_leases": [],
    "missing_plan_evidence_ids": [],
    "no_deadline_open_attempts": [],
    "requirements": [
      {
        "acceptance_criteria": [
          {
            "evidence": [
              {
                "gate": "/usr/bin/python3 -c pass",
                "kind": "command",
                "receipt_id": "CR2",
                "status": "satisfied",
                "step_id": "P1"
              }
            ],
            "id": "AC-FIXTURE",
            "status": "satisfied",
            "steps": [
              "P1"
            ],
            "text": "The fixture command exits zero."
          }
        ],
        "id": "REQ-FIXTURE",
        "status": "satisfied",
        "text": "The fixture records a successful command criterion."
      }
    ],
    "steps_without_support": [
      "P1"
    ],
    "unused_evidence_ids": []
  },
  "execution": {
    "amendments": [
      {
        "amends_attempt": "A1",
        "amends_completed_at": "2026-07-22T01:18:07+00:00",
        "attempt": "A2",
        "reason": "Exercise amendment receipts.",
        "reason_code": "operator_correction",
        "step_id": "P1"
      }
    ],
    "attempts": 2,
    "command_confirmed_high_risk": 0,
    "command_decision_counts": {
      "allowed": 2
    },
    "command_finding_categories": {},
    "command_receipts": 2,
    "command_receipts_by_provenance": {
      "observed": 2
    },
    "command_risk_counts": {
      "low": 2
    },
    "command_timed_out": 0,
    "command_timeout_seconds": {},
    "failed_attempts": [],
    "file_receipts": 2,
    "normalized_execution_sha256": "1405c67ccdfcb9b468b3d0243f0a76451555467995d6db3867bbe5b937cbbf13",
    "steps_completed": 1,
    "steps_total": 1,
    "unmapped_changed_files": [],
    "verification_runs": 3
  },
  "files": [
    {
      "path": ".agent/amendments.jsonl",
      "sha256": "e3b0c44298fc1c149afbf4c8996fb92427ae41e4649b934ca495991b7852b855"
    },
    {
      "path": ".agent/assumptions.json",
      "sha256": "c4c98e433ab1d2554ff6dcdb1917b19cc2546428ce14a9634f39d38615b49d26"
    },
    {
      "path": ".agent/capability-receipts.jsonl",
      "sha256": "5d16e777b77bd7badbbca1022c8f7411e7a5c4f92620a299dd8f6e3688ea043e"
    },
    {
      "path": ".agent/command-receipts.jsonl",
      "sha256": "9cfa77a9d81b852f3e696f0897d784a3f03fc834bc13549e7324fbbf723a9817"
    },
    {
      "path": ".agent/context-receipts.jsonl",
      "sha256": "e3b0c44298fc1c149afbf4c8996fb92427ae41e4649b934ca495991b7852b855"
    },
    {
      "path": ".agent/drift-report.json",
      "sha256": "70487cbf2a34b6638f58fe82a4ee28e882808e13ee2ecdf8b287f286eb4134f5"
    },
    {
      "path": ".agent/evidence.jsonl",
      "sha256": "e3b0c44298fc1c149afbf4c8996fb92427ae41e4649b934ca495991b7852b855"
    },
    {
      "path": ".agent/execution.contract.json",
      "sha256": "492d22a0813e815df1e90ef140951ad1ccbd3eb3a033f3e629ff2a08603393fa"
    },
    {
      "path": ".agent/failures.jsonl",
      "sha256": "e3b0c44298fc1c149afbf4c8996fb92427ae41e4649b934ca495991b7852b855"
    },
    {
      "path": ".agent/file-receipts.jsonl",
      "sha256": "3ebb048bc568d17c9f6cdabf8348f414a680f513c9576e9b4a33ac58b4837f24"
    },
    {
      "path": ".agent/plan.lock.json",
      "sha256": "07a0b586502014221fc2beafe43c891cc9823bdc95f133eb04a7315ac83cedbf"
    },
    {
      "path": ".agent/review-runs.jsonl",
      "sha256": "809fe32138ad0b2b10523d2ed16a9fa8ef5593517361d17668a7608774744dfa"
    },
    {
      "path": ".agent/runtime-snapshots.jsonl",
      "sha256": "c787582d15c2b7e1a800882ed96a849aff0d17549e1821b2b5afaf618175f290"
    },
    {
      "path": ".agent/runtime.config.json",
      "sha256": "38744c648ec18b3e4406fcf592a13515fa8151a22159ac6bed00667a5608c950"
    },
    {
      "path": ".agent/step-runs.jsonl",
      "sha256": "232111fe6be587568060f1d54695269d34b8129a08257e83a9cc6ca8867af3a1"
    },
    {
      "path": ".agent/verification-runs.jsonl",
      "sha256": "88a3f8a53f7f2617049393244fdd496297c03e1ad5c4bfb3f93d80a97922d31f"
    },
    {
      "path": ".agent/workflow.contract.json",
      "sha256": "a6b7a03b0a2043bc1d64a51f9d95cd6b3c89cd7ae1d9adcfd2c7cb80c678f92c"
    }
  ],
  "generated_from": [
    ".agent/amendments.jsonl",
    ".agent/assumptions.json",
    ".agent/capability-receipts.jsonl",
    ".agent/command-receipts.jsonl",
    ".agent/context-receipts.jsonl",
    ".agent/drift-report.json",
    ".agent/evidence.jsonl",
    ".agent/execution.contract.json",
    ".agent/failures.jsonl",
    ".agent/file-receipts.jsonl",
    ".agent/plan.lock.json",
    ".agent/review-runs.jsonl",
    ".agent/runtime-snapshots.jsonl",
    ".agent/runtime.config.json",
    ".agent/step-runs.jsonl",
    ".agent/verification-runs.jsonl",
    ".agent/workflow.contract.json"
  ],
  "meta": {
    "created_at": "2026-07-22T01:18:26+00:00",
    "tool_version": "0.4.0"
  },
  "review": {
    "correlations": [],
    "latest_review_run_id": "RR-20260719T120000Z-dd130001",
    "policy": {
      "proof_strict_effective": false,
      "require_review_run": false,
      "required_review_depth": "standard",
      "review_gate_effective": "warn",
      "verification_semantics": "ratchet-v1"
    },
    "review_runs": [
      {
        "active_blocking": [],
        "amendment_ready": false,
        "artifacts": [
          {
            "path": "docs/ai/state/main/findings-final.json",
            "sha256": "b8adad3852f196db84ad05c2affa3855c7e15d1c9d24c62c8d32165e34a82c39"
          }
        ],
        "counts_by_severity": {},
        "counts_by_status": {},
        "depth_profile": "standard",
        "findings": {
          "counts_by_severity": {},
          "counts_by_status": {},
          "index": []
        },
        "gate_status": "pass",
        "plan_sha256": "e7d52533ef71ad3762ee8582dbc6c5abf7c934ecf530bd38bf03d9c3cf979bee",
        "review_run_id": "RR-20260719T120000Z-dd130001"
      }
    ],
    "unresolved_finding_refs": []
  },
  "runtime": {
    "latest_snapshot_id": "R1",
    "mcp_server_counts": {
      "ready": 1
    },
    "mcp_servers": [
      {
        "declared_tool_count": 1,
        "id": "fixture",
        "status": "ready"
      }
    ],
    "runtime_counts": {
      "ready": 1
    }
  },
  "schema_version": "0.11.0",
  "stuck": {
    "findings": [],
    "rules_evaluated": 3
  },
  "workflow_contract": {
    "proof_policy": {
      "hunk_attribution": "enforce",
      "require_review_run": false
    },
    "required_capabilities": [
      "tdd"
    ],
    "required_gates": [
      "focused"
    ],
    "review_depth": "standard",
    "selected_by": "operator",
    "workflow_pack": "compatibility.fixture",
    "workflow_profile": "full"
  }
}
